<!ELEMENT mozi (film)*>

<!ELEMENT film (rendezo+,szinesz+,íro+)>
<!ATTLIST film id ID #REQUIRED>
<!ATTLIST film mufaj (horror | romantikus | thiller) "horror">

<!ELEMENT rendezo EMPTY>
<!ATTLIST rendezo id ID #REQUIRED>
<!ATTLIST rendezo nev CDATA #IMPLIED>

<!ELEMENT szinesz (gyerekszinesz | musicalszinesz | szinkronszinesz)*>
<!ATTLIST szinesz id ID #REQUIRED>
<!ATTLIST szinesz nev CDATA #IMPLIED>

<!ELEMENT gyerekszinesz EMPTY>
<!ELEMENT musicalszinesz EMPTY>
<!ELEMENT szinkronszinesz EMPTY>

<!ELEMENT íro EMPTY>
<!ATTLIST íro id ID #REQUIRED>