<?xml version="1.0" encoding="UTF-8"?>
<!DOCTYPE mozi SYSTEM "GMPOCB_mozi.dtd">
<mozi>
    <film id="txn_nxm_2jb" mufaj="horror">
        <rendezo id="nzk_4xm_2jb" nev="alex" />
        <szinesz id="u5g_4xm_2jb" nev="Madison_Ivy" />
        <szinesz id="a">
            <gyerekszinesz />
            <musicalszinesz />
            <szinkronszinesz />
        </szinesz>
        <íro id="trv_4xm_2jb" />
    </film>
</mozi>